,Author,Bookmarks,Comments,Post stats,Tags,Title,Views
1255,NCNecros,113,10.0,24.0,"['Python', 'Разработка веб-сайтов']","Мега-Учебник Flask, Часть 11: Поддержка e-mail","15,4k"
1256,NCNecros,93,4.0,15.0,"['Python', 'Разработка веб-сайтов']","Мега-Учебник Flask, Часть 10: Полнотекстовый поиск","12,5k"
1257,Imbolc,58,6.0,11.0,"['Angular', 'Python']",Окружение для разработки на aiorest (asyncio) + angular.js,"5,7k"
1258,marrrvin,99,9.0,54.0,"['Блог компании Mail.Ru Group', 'Python', 'Разработка веб-сайтов']",Push-уведомления в REST API на примере системы Таргет Mail.Ru,"20,4k"
1259,madcat1991,121,13.0,34.0,"['Блог компании Онлайн-кинотеатр ivi', 'Алгоритмы', 'Python']",Item-based коллаборативная фильтрация своими руками,"11,7k"
1260,redlinelm,79,36.0,,"['Алгоритмы', 'Python']",Выразительная простота python на примере задач из комбинаторики,"19,1k"
1261,gogolgrind,84,2.0,13.0,['Python'],Удаленное управление VLC player’ом при помощи Arduino и Python,"12,6k"
1262,kuznetsovin,378,8.0,33.0,"['Программирование', 'Python']",Интеграция MS Excel и Python,126k
1263,iBlacksus,295,19.0,29.0,['Python'],Как мы делали небольшую охранную систему на RPi. Часть 1,"36,1k"
1264,TeamMRG,10,4.0,37.0,"['Блог компании Mail.Ru Group', 'Python', 'Разработка веб-сайтов']",Приглашаем на Moscow Django Meetup 31 июля,"4,1k"
1265,Dead_Angel,45,,18.0,['Python'],"Python-digest #34. Новости, интересные проекты, статьи и интервью [20 июля 2014 — 27 июля 2014]","6,1k"
1266,Imbolc,120,8.0,30.0,"['MongoDB', 'Python', 'Разработка веб-сайтов']","Современный торнадо, часть 2: блокирующие операции","14,7k"
1267,gralexey,224,11.0,17.0,"['Блог компании Mail.Ru Group', 'Программирование', 'Python']",Практика программирования игр на python: жизнь,"52,9k"
1268,NCNecros,88,4.0,12.0,"['Python', 'Разработка веб-сайтов']","Мега-Учебник Flask, Часть 9: Пагинация","16,3k"
1269,D_E_S,37,,,"['Python', 'Тестирование IT-систем']",Браузерный робот на Sikuli IDE для игры MusicWars,"6,8k"
1270,NCNecros,111,5.0,23.0,"['Разработка веб-сайтов', 'Python']","Мега-Учебник Flask, Часть 8: Подписчики, контакты и друзья","15,6k"
1271,Imbolc,301,16.0,78.0,"['MongoDB', 'Python']",Современный Торнадо: распределённый хостинг картинок в 30 строк кода,"32,6k"
1272,Dead_Angel,92,3.0,35.0,['Python'],"Python-digest #33. Новости, интересные проекты, статьи и интервью [13 июля 2014 — 20 июля 2014]","10,7k"
1273,Jirvil,93,11.0,11.0,"['Системное программирование', 'Python']",Измеряем температуру: TEMPer + Python + Windows,"17,3k"
1274,homm,275,12.0,23.0,"['Django', 'Python']",Эффективная многопоточность в Python,"46,4k"
1275,Dead_Angel,117,7.0,54.0,['Python'],"Python-digest #32. Новости, интересные проекты, статьи и интервью [6 июля 2014 — 13 июля 2014]","13,4k"
1276,XaocCPS,80,18.0,15.0,"['Microsoft Azure', 'Блог компании Microsoft', 'Python']",Как управлять облачными ресурсами с помощью Python? Поднимаем кластеры по запросу через несколько строк кода,"6,3k"
1277,alizar,68,31.0,34.0,['Python'],Python вышел на 1-е место для обучения программированию в университетах США,"39,1k"
1278,Dead_Angel,91,7.0,55.0,['Python'],"Python-digest #31. Новости, интересные проекты, статьи и интервью [8 июня 2014 — 6 июля 2014] Возрождение","9,7k"
1279,larrabee,402,21.0,39.0,['Python'],Десятимиллионный скрипт резервного копирования,"42,8k"
1280,stalkerg,79,9.0,2.0,['Python'],Быстрые аналоги популярных библиотек для Python,"16,4k"
1281,vladkozlovski,119,59.0,52.0,"['Разработка веб-сайтов', 'Python', 'Node.JS']",Немного тестов производительности сетевых фреймворков,"20,4k"
1282,fu2re,96,3.0,6.0,"['Блог компании Starttospeak.com', 'Django', 'Python']",Django widgets и еще пара трюков,18k
1283,datacompboy,72,12.0,26.0,"['Реверс-инжиниринг', 'Python']",Как запатчить 11 разных прошивок и не сойти с ума от разнообразия,"10,2k"
1284,gerasimovich,179,8.0,35.0,"['Блог компании IT-People', 'Django', 'Python']",PyCon Russia 2014 — два дня python-счастья,15k
1285,neverver,91,11.0,45.0,['Python'],Addon для генерации материалов Cycles Blender,"24,5k"
1286,BasicWolf,95,28.0,39.0,"['Lisp', 'Python', 'Ненормальное программирование']",Мини-интерпретатор Lisp'a на Python,"16,9k"
1287,kmike,80,5.0,25.0,['Python'],Про колеса,"13,1k"
1288,eastbanctech,211,10.0,17.0,"['Блог компании EastBanc Technologies', 'SQL', 'Python']",Вводная по сложным запросам в SQLAlchemy,"40,2k"
1289,gangreyw,121,7.0,18.0,"['Отладка', 'Django', 'Python']",Настройка удаленного интерпретатора на Pycharm для Django,"24,4k"
1290,moigagoo,91,17.0,31.0,['Python'],"Питон, смещение тона и Пианопьютер","12,5k"
1291,alrusdi,87,10.0,58.0,"['Python', 'Разработка веб-сайтов']","Python-digest #30. Новости, интересные проекты, статьи и интервью [2 июня 2014 — 8 июня 2014]","13,3k"
1292,alizar,180,33.0,62.0,['Python'],Micro Python — эффективная реализация Python 3 для микроконтроллеров,"32,4k"
1293,Relrin,478,47.0,46.0,"['VIM', 'Python']",VIM как IDE для разработки на Python,"90,5k"
1294,quas,62,12.0,18.0,"['Qt', 'Python']",Геодезия: по полю на «питоне»,"12,3k"
1295,clutcher,18,2.0,4.0,['Python'],Разработка ERP на tryton: Часть 3,"5,5k"
1296,alrusdi,76,1.0,45.0,"['Python', 'Разработка веб-сайтов']","Python-digest #29. Новости, интересные проекты, статьи и интервью [25 мая 2014 — 1 июня 2014]","12,4k"
1297,uthunderbird,39,2.0,17.0,"['Программирование', 'Python', 'Разработка веб-сайтов']",Thunderargs: практика использования. Часть 1,"5,3k"
1298,beenom,58,40.0,73.0,"['Блог компании JetBrains', 'Django', 'Python']",Вышел обновленный PyCharm 3.4 с новой расширенной функциональностью и улучшенной общей производительностью,"23,4k"
1299,clutcher,28,,10.0,['Python'],Разработка ERP на tryton: Часть 2,"5,7k"
1300,Alex118,193,14.0,25.0,['Python'],Работа с иностранными текстами. Как увеличить процент понимания и выучить язык?,"31,4k"
1301,siberianMan,93,27.0,8.0,['Python'],Генераторы словарей,29k
1302,alrusdi,103,7.0,54.0,"['Python', 'Разработка веб-сайтов']","Python-digest #28. Новости, интересные проекты, статьи и интервью [19 мая 2014 — 25 мая 2014]","13,2k"
1303,markhor,38,26.0,54.0,['Python'],"os.urandom, CPython, Linux и грабли",17k
1304,SlivTime,98,3.0,16.0,"['Python', 'Разработка веб-сайтов']","Мега-Учебник Flask, Часть 7: Unit-тестирование","21,5k"
1305,CRImier,157,39.0,12.0,['Python'],"Pautomount — демон автоматического монтирования, запуска скриптов и всего такого прочего","10,8k"
1306,Biblusha,116,,16.0,"['Разработка веб-сайтов', 'Python']","Мега-Учебник Flask, Часть 6: Страница профиля и аватарка","22,5k"
1307,Wargaming,85,15.0,20.0,"['Блог компании Wargaming', 'Программирование', 'Python']",Python Meetup: апрельская встреча,"10,1k"
1308,alrusdi,93,10.0,54.0,"['Python', 'Разработка веб-сайтов']","Python-digest #27. Новости, интересные проекты, статьи и интервью [12 мая 2014 — 18 мая 2014]","12,3k"
1309,gerasimovich,131,12.0,26.0,"['Блог компании IT-People', 'Django', 'Python']",ТОП-10 докладов с PyConRu 2013,"11,9k"
1310,uthunderbird,77,7.0,22.0,"['Программирование', 'Python', 'Ненормальное программирование']",Один вариант использования аннотаций,"11,9k"
1311,SlivTime,204,10.0,21.0,"['Python', 'Разработка веб-сайтов']","Мега-Учебник Flask, Часть 5: Вход пользователей","54,5k"
1312,gerasimovich,17,44.0,54.0,"['Блог компании IT-People', 'Python']",Внутренняя кухня организации PyCon Russia и международные отношения,"16,4k"
1313,Wargaming,44,6.0,13.0,"['Блог компании Wargaming', 'Программирование', 'Python']",Python Meetup: мартовская встреча,"6,2k"
1314,kuznetsovin,128,,13.0,"['Data Mining', 'Python']",Организация OLAP куба средствами Python,"13,6k"
1315,sallyruthstruik,70,6.0,31.0,['Python'],Python Webmoney API,"9,9k"
1316,alrusdi,85,4.0,49.0,"['Python', 'Разработка веб-сайтов']","Python-digest #26. Новости, интересные проекты, статьи и интервью [4 мая 2014 — 11 мая 2014]","14,4k"
1317,Utter_step,125,25.0,71.0,"['Разработка веб-сайтов', 'Совершенный код', 'Python']",И снова про опасность eval(),"54,7k"
1318,clutcher,43,11.0,3.0,['Python'],Разработка ERP на tryton: Часть 1,"11,4k"
1319,alrusdi,90,8.0,66.0,"['Python', 'Разработка веб-сайтов']","Python-digest #25. Новости, интересные проекты, статьи и интервью [28 апреля 2014 — 4 мая 2014]","11,8k"
1320,SteveNers,298,31.0,73.0,"['Python', 'Разработка веб-сайтов']",Легкий python веб-фреймворк: Bottle,"63,2k"
1321,STLEON,299,40.0,26.0,"['Программирование', 'Python']",Анализ дружеских связей VK с помощью Python,"57,8k"
1322,elena_voronina,21,6.0,24.0,"['Блог компании IT-People', 'Django', 'Python']",Программа PyCon Russia 2014,5k
1323,alrusdi,118,5.0,109.0,"['Python', 'Разработка веб-сайтов']","Python-digest #24. Новости, интересные проекты, статьи и интервью [20 апреля 2014 — 27 апреля 2014]","14,8k"
1324,maleficxp,643,83.0,93.0,"['Обработка изображений', 'Python']",Съёмка показаний счетчика на телефон с последующим распознаванием,144k
1325,romamo,14,4.0,5.0,"['Sphinx', 'Python']",import sphinxapi без танцев или простая установка sphinxapi.py через pip,"3,5k"
1326,kuznetsovin,365,9.0,34.0,['Python'],Основы парсинга с помощью Python+lxml,131k
1327,alrusdi,93,5.0,43.0,"['Python', 'Разработка веб-сайтов']","Python-digest #23. Новости, интересные проекты, статьи и интервью [13 апреля 2014 — 20 апреля 2014]","10,3k"
1328,svfat,177,41.0,23.0,"['Django', 'Python', 'Тестирование IT-систем']",BDD-разработка на django,"14,9k"
1329,EgorLyutov,32,6.0,2.0,['Python'],Добавляем IP телефоны в отдельный Pool IP адресов по Mac адресу,"6,9k"
1330,atomlib,96,126.0,37.0,"['Программирование', 'Python', 'Ненормальное программирование']",Непайтоновый Пайтон,"26,7k"
1331,SECL,282,56.0,35.0,"['Блог компании SECL Group', 'Python', 'Разработка веб-сайтов']",Высоконагруженные сайты и приложения на Python / Django (29 проектов),"92,3k"
1332,kuznetsovin,38,8.0,6.0,['Python'],Обзор IPython Notebook 2.0,"42,5k"
1333,AndrewRomanenco,54,29.0,40.0,"['Разработка веб-сайтов', 'Java', 'Python']",Java Virtual Machine in pure python,"10,3k"
1334,shulyndina,6,,3.0,"['Блог компании IT-People', 'Программирование', 'Python']","Второй PyCon Russia: Екатеринбург, 2-3 июня","2,5k"
1335,svetlov,95,36.0,37.0,['Python'],Работа с ZeroMQ и PostgreSQL в asyncio,"12,2k"
1336,alrusdi,90,5.0,46.0,"['Python', 'Разработка веб-сайтов']","Python-digest #21. Новости, интересные проекты, статьи и интервью [30 марта 2014 — 6 апреля 2014]","13,9k"
1337,eugenechepurniy,29,,6.0,['Python'],SaltStack: использование шаблонов jinja и хранилища pillar для гибкой настройки конфигураций,"7,3k"
1338,Velese,64,9.0,50.0,"['Разработка игр', 'Python']",Соединяем эллиптический тренажер и pygame,"20,8k"
1339,stalkerg,53,36.0,16.0,['Python'],Habrachat или использование ARM сервера,"15,3k"
1340,alrusdi,79,3.0,35.0,"['Python', 'Разработка веб-сайтов']","Python-digest #20. Новости, интересные проекты, статьи и интервью [23 марта 2014 — 30 марта 2014]","8,8k"
1341,ilusha_sergeevich,219,14.0,52.0,"['Python', 'Open source']",MakeHuman: релиз спустя 12 лет разработки,"36,1k"
1342,Alesh,116,9.0,29.0,"['Программирование', 'Python', 'Разработка веб-сайтов']",Примеры использования asyncio: HTTPServer?!,"32,9k"
1343,ServerClub,184,10.0,16.0,"['Блог компании ServerClub', 'Python']",Запуск локальных ssh/telnet/vnc клиентов по ссылке из карты Zabbix,"20,6k"
1344,evil_factory,148,82.0,24.0,['Python'],Учимся бороться с ëÒÁËÏÚÑÂÒÙ,"29,3k"
1345,Wargaming,38,4.0,18.0,"['Блог компании Wargaming', 'Программирование', 'Python']",Python Meetup: февральская встреча,"6,7k"
1346,stalkerg,32,9.0,19.0,['Python'],Тестируем ARM платформу Marvel Armada XP как хостинг для Python проекта,"7,9k"
1347,kAIST,186,18.0,55.0,"['Разработка веб-сайтов', 'Python']","Transcend WiFi. Пишем клиент Shoot&View для Windows, Mac и Linux","27,1k"
1348,tenoclock,206,19.0,32.0,"['Программирование', 'Python']",Просим Вконтакте напомнить про пельмешки,"43,9k"
1349,tenoclock,189,25.0,47.0,"['Python', 'Информационная безопасность']",Как я немного Instagram увёл,"90,2k"
1350,idpiter,287,27.0,17.0,"['Блог компании Издательский дом «Питер»', 'Python']",Программируем на Python,"50,5k"
1351,r0_Crew,111,2.0,43.0,"['Assembler', 'Python', 'Информационная безопасность']","Сломай меня полностью (ZeroNightsCrackme, Часть 2)","13,4k"
1352,Wargaming,57,,16.0,"['Блог компании Wargaming', 'Программирование', 'Python']",Python Meetup: январская встреча,"6,6k"
1353,hardex,87,10.0,38.0,"['Программирование', 'Python']",Веб-интерфейс для кофеварки на Ajenti через HTCPCP,"17,2k"
1354,nvbn,79,16.0,25.0,['Python'],Управление роборукой при помощи leap motion,"15,5k"
1355,zstan,53,11.0,5.0,"['Google App Engine', 'Программирование', 'Python']","Пишем мониторинг наличия билетов на РЖД, part 2","11,1k"
1356,suguby,43,8.0,15.0,['Python'],"Уведомления окончаний fabric задач, с декораторами и детальной информацией","3,8k"
1357,Deepwalker,25,40.0,4.0,"['Python', 'Ruby']","Открытые классы в ruby, заметки для питонистов",5k
1358,rzhannoy,129,21.0,15.0,"['Совершенный код', 'Django', 'Python']",Об организации кода в django-приложениях или толстые модели – это прекрасно,"20,3k"
1359,Zenogears,140,18.0,26.0,"['Разработка игр', 'Python', 'Open source']","Основы создания 2D персонажа в Godot. Часть 2: компилирование шаблонов, немного о GDScript, движение и анимация героя","18,6k"
1360,Zenogears,169,23.0,28.0,"['Разработка игр', 'Python', 'Open source']","Основы создания 2D персонажа в Godot. Часть 1: компилирование игрового движка, создание проекта и анимация покоя героя","34,6k"
1361,komissarex,87,16.0,44.0,"['Программирование', 'Python']",Про сообщества программистов,"29,9k"
1362,CLTanuki,91,15.0,14.0,"['Django', 'Python']",Несколько полезных полей Django,"15,3k"
1363,Skycker,181,21.0,31.0,"['Алгоритмы', 'Python', 'Криптография']",AES-128. Детали и реализация на python,"34,8k"
1364,drJonnie,97,38.0,23.0,"['Программирование', 'Python']",Внедрение зависимостей the Python way,"16,8k"
1365,alizar,347,12.0,64.0,"['Разработка игр', 'Python', 'Open source']",Игровой движок Godot отдали в общественное пользование,40k
1366,alrusdi,109,13.0,44.0,['Python'],"Python-digest #13. Новости, интересные проекты, статьи и интервью [31 января 2014 — 9 февраля 2014]","14,9k"
1367,raacer,23,151.0,,"['Python', 'PHP', 'Разработка веб-сайтов']",Опрос: PHP vs Python,"54,6k"
1368,akava,383,52.0,39.0,"['Django', 'Программирование', 'Python']","Google Calendar, как бесплатный СМС гейт","60,1k"
1369,Koshelenok,171,40.0,10.0,['Python'],Простой скрипт на Python для заучивания английских слов или почему я не использую карточки,"19,8k"
1370,d5v,40,6.0,5.0,"['Программирование', 'Python']",Python на страже кошелька,"10,2k"
1371,philipto,54,39.0,75.0,"['Блог компании JetBrains', 'Программирование', 'Python']",Выпущен обновленный PyCharm 3.1 с поддержкой Python 3.4 и Django 1.6: что стало лучше?,"21,6k"
1372,erthalion,93,46.0,44.0,"['Haskell', 'VIM', 'Python']",Vim-крокет,"15,3k"
1373,batment,120,13.0,19.0,"['Django', 'Python']",Простейший способ добавить WebSocket в Django,20k
1374,alrusdi,121,9.0,48.0,['Python'],"Python-digest #12. Новости, интересные проекты, статьи и интервью [24 января 2013 — 31 января 2014]","12,3k"
1375,kuznetsovin,121,5.0,17.0,"['R', 'Data Mining', 'Python']",Построение модели SARIMA с помощью Python+R,"18,5k"
1376,komissarex,180,32.0,36.0,"['Программирование', 'Python']",Python на колёсах,"66,7k"
1377,hlamer,111,4.0,26.0,"['Qt', 'Python']","PyQt. Управляем памятью, собираем мусор","14,9k"
1378,zstan,152,14.0,10.0,"['Google App Engine', 'Программирование', 'Python']",Пишем мониторинг наличия билетов на РЖД,"24,4k"
1379,maratvildan,188,18.0,4.0,['Python'],Четыре метода загрузки изображений с веб-сайта с помощью Python,"40,6k"
1380,alrusdi,92,4.0,33.0,['Python'],"Python-digest #11. Новости, интересные проекты, статьи и интервью [17 января 2013 — 24 января 2014]",10k
1381,freetonik,562,73.0,153.0,['Python'],Почему существует так много Питонов?,"82,8k"
1382,oxyberg,108,1.0,26.0,['Python'],Простой интерпретатор с нуля на Python #4,"11,1k"
1383,alrusdi,86,14.0,32.0,['Python'],"Python-digest #10. Новости, интересные проекты, статьи и интервью [10 января 2013 — 17 января 2014]","8,7k"
1384,vitaly-murashev,130,14.0,40.0,"['Блог компании Acronis, Inc', 'Программирование', 'Python']",Создание zip-модулей в python,"11,9k"
1385,FINTER,175,34.0,44.0,"['Python', 'Разработка веб-сайтов']",Deploy с помощью Salt,27k
1386,CJay,120,1.0,22.0,['Python'],Простой интерпретатор с нуля на Python (часть 3),"10,9k"
1387,whileNotFalse,64,19.0,5.0,"['Алгоритмы', 'Python']",Извлечение «знаний» или классификация в один if,"9,6k"
1388,icoz,929,93.0,85.0,"['PDF', 'Python']",Экспорт Избранного на Хабре в PDF,"32,7k"
1389,kharlashkin,13,29.0,,"['Python', 'Тестирование IT-систем']",Поддержка обратной связи геймпадом в WoT,21k
1390,GDApsy,164,53.0,70.0,['Python'],Катастрофа Unicode в Python3,"87,8k"
1391,whileNotFalse,78,8.0,14.0,"['Алгоритмы', 'Python']",Восстановление логической функции,11k
1392,Tiendil,42,17.0,12.0,['Python'],Ещё одна реализация Enums для Python,15k
1393,JRazor,986,120.0,101.0,['Python'],"Python: вещи, которых вы могли не знать",212k
1394,akaurov,176,85.0,85.0,['Python'],Вычисляем какой сейчас год от Большого Взрыва на Питоне,"47,1k"
1395,Zoberg,173,98.0,66.0,"['JavaScript', 'Python']",IT-книги по свободной цене,"73,8k"
1396,oxyberg,145,,24.0,['Python'],Простой интерпретатор с нуля на Python #2,13k
1397,Imbolc,34,24.0,33.0,['Python'],Поиск python пакетов,"5,4k"
1398,rzhannoy,210,46.0,46.0,"['Python', 'Разработка веб-сайтов']","Peewee – лёгкая, гибкая и очень быстрая ORM на Python","43,9k"
1399,kuznetsovin,245,13.0,30.0,"['Data Mining', 'Python']",Анализ временных рядов с помощью python,54k
1400,rzhannoy,269,6.0,33.0,"['Программирование', 'Python']",Интерпретатор Python: о чём думает змея? (часть I-III),"32,3k"
1401,andymitrich,3044,65.0,142.0,"['Программирование', 'Python']",Python на Хабре,354k
1402,Wargaming,103,2.0,26.0,"['Блог компании Wargaming', 'Программирование', 'Python']",Python Meetup: ноябрьская встреча,"8,7k"
1403,oxyberg,231,14.0,22.0,['Python'],Простой интерпретатор с нуля на Python (перевод) #1,"28,9k"
1404,kuznetsovin,165,20.0,19.0,"['Data Mining', 'Python']",Пример решения задачи множественной регрессии с помощью Python,"45,1k"
1405,lightman,143,61.0,50.0,['Python'],Почему я ненавижу virtualenv и pip,"72,4k"
1406,Santiago26,130,20.0,30.0,"['Python', 'Системы обмена сообщениями']",ВКонтакте без джаббера и снова с ним,"50,5k"
1407,HgeN,32,6.0,6.0,"['Python', 'Тестирование IT-систем', 'Open source']",Continuous Integration вместе с buildbot: а зачем?,"9,1k"
1408,KestL,131,39.0,53.0,['Python'],Python для микроконтроллеров,"45,3k"
1409,Dreadatour,310,26.0,46.0,"['Блог компании Mail.Ru Group', 'Django', 'Python']","Профилирование и отладка Python, отладка","55,2k"
1410,kuznetsovin,272,8.0,38.0,"['Data Mining', 'Python']",Введение в анализ текстовой информации с помощью Python и методов машинного обучения,33k
1411,argz,159,34.0,57.0,"['Программирование', 'Python']",Flightstats API: Пишем свое табло прилетов с Боингами и Аэробусами,"24,4k"
1412,hardex,66,18.0,23.0,"['Программирование', 'Python']",PyFence: верификация типов для Python,"6,3k"
