,Author,Bookmarks,Comments,Post stats,Tags,Title,Views
468,telezhnaya,85,15.0,32.0,"['Машинное обучение', 'Python', 'Open source', 'Блог компании Microsoft']",Программируем в мире Minecraft,"19,4k"
469,andrewnester,53,3.0,17.0,"['Разработка веб-сайтов', 'Программирование', 'Машинное обучение', 'Python', 'Django']","Pygest #11. Релизы, статьи, интересные проекты из мира Python [6 июня 2017 — 19 июня 2017]","9,7k"
470,Scorobey,47,,5.0,['Python'],Моделирование переходных процессов при коммутации электрической цепи средствами Python,"5,5k"
471,Dmitry21,19,8.0,,"['Программирование', 'Python', 'Блог компании Отус']","Разбираемся в джунглях программирования, или почему Маугли дружил с Python?","4,8k"
472,snakers4,77,6.0,38.0,"['Обработка изображений', 'Машинное обучение', 'Python', 'Open source', 'Data Mining']",Нейрокурятник: часть 4 — итоговая модель и код на прод,"9,6k"
473,gsedometov,93,8.0,13.0,"['Визуализация данных', 'Python']","Отзывчивые столбчатые диаграммы с Bokeh, Flask и Python 3","8,3k"
474,Scorobey,128,8.0,12.0,['Python'],Решение задач линейного программирования с использованием Python,18k
475,Dmitry21,21,15.0,,"['Программирование', 'Python', 'Блог компании Отус']","Набор на курс Python: почему мы думаем, что Python 2.7. — это серьезно, а Python 3 — модно","7,5k"
476,DataArt,96,22.0,6.0,"['Разработка робототехники', 'Разработка под Linux', 'Алгоритмы', 'Python', 'Блог компании DataArt']",Генерируем произвольные последовательности на выводах платы Raspberry Pi,8k
477,shulyndina,18,5.0,15.0,"['Разработка веб-сайтов', 'Программирование', 'Python', 'Django', 'Блог компании IT-People']","Предварительная программа PyConRu-2017: выступят докладчики из Disney, Facebook, Яндекса, JetBrains, Тинькофф Банка","4,2k"
478,andrewnester,65,8.0,19.0,"['Разработка веб-сайтов', 'Программирование', 'Python', 'Django']","Pygest #10. Релизы, статьи, интересные проекты из мира Python [23 мая 2017 — 5 июня 2017]","11,5k"
479,TyVik,176,213.0,44.0,"['Программирование', 'Python']","Да, Python медленный, но меня это не волнует","48,6k"
480,kvothe,136,13.0,15.0,"['Программирование', 'Python']",Именованные кортежи. Пишем код на Python чище,"18,9k"
481,andd3dfx,131,10.0,31.0,"['Машинное обучение', 'Python', 'Data Mining']",Анализ рынка недвижимости методом случайного леса,"16,8k"
482,Scorobey,99,1.0,10.0,['Python'],Решение задачи коммивояжёра методом ближайшего соседа на Python,"13,4k"
483,markhor,121,15.0,72.0,"['Системное программирование', 'Машинное обучение', 'Алгоритмы', 'Python', 'Блог компании Mail.Ru Group']",Эксперименты с malloc и нейронными сетями,24k
484,born_2fuck,65,10.0,9.0,"['Занимательные задачки', 'Python']",Расчет оттока клиентов банка (решение задачи с помощью Python),"7,1k"
485,netologyru,75,9.0,,"['R', 'Python', 'Data Mining', 'Big Data', 'Блог компании Нетология']","8 навыков, необходимых в профессии Data Scientist","13,1k"
486,kuznetsovin,43,19.0,8.0,"['Разработка веб-сайтов', 'Python', 'PostgreSQL', 'Django']",Сравнение производительности иерархических моделей Django и PostgreSQL,"5,3k"
487,andrewnester,61,2.0,21.0,"['Программирование', 'Python']","Pygest #9. Релизы, статьи, интересные проекты из мира Python [8 мая 2017 — 22 мая 2017]",9k
488,netologyru,85,10.0,3.0,"['R', 'Python', 'Data Mining', 'Big Data', 'Блог компании Нетология']",Обзор профессии Data Scientist,29k
489,AloneCoder,85,24.0,61.0,"['Программирование', 'Кодобред', 'Алгоритмы', 'Python', 'Блог компании Mail.Ru Group']",Разбиение слов на элементы таблицы Менделеева,"15,6k"
490,snakers4,61,2.0,18.0,"['Обработка изображений', 'Машинное обучение', 'Python', 'Open source', 'Data Mining']","Нейрокурятник часть 2: про бота, который постит фотографии",9k
491,rdruzyagin,67,6.0,12.0,"['Машинное обучение', 'SQL', 'Python', 'Oracle', ""Блог компании PG Day'17 Russia""]",Механизм подсчета нейронной сети в PL/SQL для распознавания рукописных цифр,"8,3k"
492,mitinsvyat,127,44.0,36.0,"['Тестирование веб-сервисов', 'Python', 'Google Chrome']",Web crawler с использованием Python и Chrome,"20,2k"
493,wunder_editor,149,29.0,66.0,"['Ненормальное программирование', 'Высокая производительность', 'Python', 'Блог компании Wunder Fund']","О том, как в Instagram отключили сборщик мусора Python и начали жить","33,8k"
494,Dimi3,38,2.0,7.0,"['Информационная безопасность', 'Python', 'NoSQL']",Анализ комуникации из Tor сети в инфраструктуру с помощью ELK стека,"5,5k"
495,akrot,48,2.0,12.0,"['Алгоритмы', 'Python', 'Data Mining', 'Big Data', 'Блог компании Школа Данных']",Проблемы современного Data Science,"10,7k"
496,Scorobey,77,3.0,13.0,['Python'],Модель ПИД регулятора на Python,"8,4k"
497,AloneCoder,287,62.0,48.0,"['Разработка веб-сайтов', 'Проектирование и рефакторинг', 'Python', 'Django', 'Блог компании Mail.Ru Group']","10 основных ошибок, совершаемых Django-разработчиками","42,8k"
498,egor_labintcev,193,4.0,38.0,"['Машинное обучение', 'Математика', 'Python', 'Data Mining', 'Блог компании Open Data Science']",Метрики в задачах машинного обучения,"43,9k"
499,KitScribe,68,12.0,5.0,"['Программирование', 'Отладка', 'Python']",Как я писал свой логгер. Разбор ошибок,"6,7k"
500,i_love_cats,176,10.0,19.0,"['Python', 'Google API', 'API']","Пишем скрипт для синхронизации папок с Google Drive, плюс учимся использовать Google Drive API",22k
501,synedra,31,6.0,3.0,"['ООП', 'Ненормальное программирование', 'Python']",Изменяемые свойства классов в питоне: польза для дела и мелкого хулиганства,"4,5k"
502,snakers4,188,10.0,18.0,"['Машинное обучение', 'Математика', 'Python', 'Open source', 'Data Mining']",Нейрокурятник ч.0. Или нейро- без курятника,"17,3k"
503,andrewnester,64,2.0,15.0,"['Программирование', 'Python']","Pygest #8. Релизы, статьи, интересные проекты из мира Python [11 апреля 2017 — 7 мая 2017]","9,1k"
504,Palich239,23,12.0,6.0,"['Программирование', 'Высокая производительность', 'Python', 'NoSQL']",Профилирование и оптимизация символьных вычислений для будущего сервера,"3,1k"
505,Scorobey,121,3.0,28.0,['Python'],Простая модель адаптивного фильтра Калмана средствами Python,"11,6k"
506,bulygin69,20,6.0,,"['Занимательные задачки', 'Python']",Есть и нет,4k
507,snakers4,119,32.0,35.0,"['Машинное обучение', 'Python', 'Open source', 'Data Mining']",Нейрокурятник: часть 1. Установка Raspberry Pi и камеры в курятник и их настройка,"19,5k"
508,Scorobey,48,2.0,19.0,['Python'],От двух камертонов из опытов Лиссажу к одной эллиптической уровнемерной трубке с шагом в столетия и всё на Python,"5,8k"
509,shulyndina,10,3.0,8.0,"['Разработка веб-сайтов', 'Программирование', 'Python', 'Django', 'Блог компании IT-People']",Юбилейный PYCON RUSSIA пройдёт 16-17 июля,"2,3k"
510,myarik,66,14.0,11.0,"['Python', 'Django']",Поиск в Django REST Framework с помощью Elasticsearch,"6,7k"
511,Ferres,85,3.0,36.0,"['Машинное обучение', 'Математика', 'Python', 'Data Mining', 'Блог компании Open Data Science']",PyMC3 — MCMC и не только,"10,6k"
512,elder_cat,45,91.0,18.0,"['Python', 'Perl', 'Блог компании Everyday Tools']",«Почему вы просто не перепишете это на язык X?»,"17,7k"
513,Skolopendriy,305,18.0,51.0,"['Машинное обучение', 'Математика', 'Алгоритмы', 'Python', 'Блог компании Open Data Science']",Открытый курс машинного обучения. Тема 9. Анализ временных рядов с помощью Python,62k
514,bibilov,16,,5.0,"['Промышленное программирование', 'Программирование', 'Машинное обучение', 'Python', 'Блог компании Проектная школа программирования GoTo']",GoTo Data Science Challenge 2: гранты на летнюю школу,"4,5k"
515,VyacheslavAkhmetov,57,5.0,26.0,"['Python', 'Блог компании Селектел']",The uWSGI Spooler,"5,2k"
516,sgaynetdinov,88,9.0,22.0,"['Вконтакте API', 'Python']",Публикация постов Вконтакте через Trello,"8,6k"
517,VanSuede,59,6.0,19.0,"['Машинное обучение', 'Python', 'Data Mining']",Предсказываем популярность статьи на TJ,"8,8k"
518,madrugado,230,13.0,55.0,"['Машинное обучение', 'Математика', 'Python', 'Data Mining', 'Блог компании Open Data Science']",Библиотеки для глубокого обучения: Keras,"50,5k"
519,homm,141,26.0,64.0,"['Обработка изображений', 'Высокая производительность', 'Python', 'C']","Как я сделал самый быстрый ресайз изображений. Часть 2, SIMD","16,9k"
520,strorinWind,183,10.0,13.0,"['Вконтакте API', 'Python']",Чат-бот для ВКонтакте на Python на Callback API,"52,9k"
521,Highstaker,66,21.0,24.0,"['Тестирование веб-сервисов', 'Разработка под Linux', 'Python']",Обманываем время: о тестировании с «подставным» временем на Linux и Docker,"6,1k"
522,yorko,178,21.0,39.0,"['Машинное обучение', 'Алгоритмы', 'Python', 'Data Mining', 'Блог компании Open Data Science']",Открытый курс машинного обучения. Тема 8. Обучение на гигабайтах с Vowpal Wabbit,38k
523,Roman_Kh,103,13.0,15.0,"['Машинное обучение', 'Python', 'Data Mining', 'Big Data']",Data science и качественный код,"10,1k"
524,ins2718,455,8.0,44.0,"['Машинное обучение', 'Алгоритмы', 'Python']",Введение в машинное обучение с tensorflow,"70,1k"
525,feriat,45,15.0,18.0,"['Геоинформационные сервисы', 'Python']",Как быстрее всего сфоткать 35 билбордов в Москве,"7,3k"
526,spiralis,411,15.0,83.0,"['Машинное обучение', 'Математика', 'Алгоритмы', 'Python', 'Блог компании Open Data Science']",Библиотека глубокого обучения Tensorflow,"53,8k"
527,nevmenandr,104,41.0,56.0,"['Семантика', 'Python']",Векторные модели и русская литература,"14,3k"
528,Dendefo,59,30.0,6.0,['Python'],Создание сапера при помощи модуля Tkinter,5k
529,kucev,176,15.0,6.0,"['Вконтакте API', 'Python']",Как написать чат-бота для vk.com за 3 минуты,126k
530,Scorobey,36,2.0,7.0,['Python'],Модель колебательного звена в режиме резонансных колебаний на Python,"2,4k"
531,werevolff,58,8.0,13.0,"['Python', 'PostgreSQL', 'Django']",Нескучные запросы с Django ORM Annotate и Query Expressions,"8,2k"
532,FUNNYDMAN,158,14.0,8.0,"['Qt', 'Python']",Начинаем работу Python + Qt5 + QML урок №1,"21,3k"
533,dmytrostriletskyi,48,1.0,7.0,"['Разработка мобильных приложений', 'Python', 'Open source', 'GitHub']","Когда GitHub выстреливает вам в голову, создается новый фреймворк. Идея, концепция и реализация «Rutetider»","5,7k"
534,andrewnester,53,,14.0,"['Программирование', 'Python']","Pygest #7. Релизы, статьи, интересные проекты из мира Python [28 марта 2017 — 10 апреля 2017]","8,2k"
535,ternaus,189,42.0,74.0,"['Обработка изображений', 'Машинное обучение', 'Алгоритмы', 'Python', 'Блог компании Open Data Science']",Kaggle: Британские спутниковые снимки. Как мы взяли третье место,"29,9k"
536,KuzmaKhrabrov,90,12.0,50.0,"['Машинное обучение', 'Математика', 'Алгоритмы', 'Python', 'Блог компании Mail.Ru Group']",Нейронные сети в борьбе с раком,12k
537,servancho,159,19.0,22.0,"['Python', 'Django', 'API']",7 вредных советов проектировщику REST API,"16,2k"
538,ph_piter,117,23.0,15.0,"['Профессиональная литература', 'Python', 'Блог компании Издательский дом «Питер»']",Книга «Программируем на Python»,23k
539,mephistopheies,202,49.0,63.0,"['Тестирование веб-сервисов', 'Машинное обучение', 'Математика', 'Python', 'Блог компании Open Data Science']",Байесовские многорукие бандиты против A/B тестов,"24,5k"
540,Scorobey,50,5.0,10.0,['Python'],Модель колебательного звена с применением символьного и численного решений дифференциального уравнения на SymPy и NumPy,"5,4k"
541,FUNNYDMAN,129,18.0,21.0,['Python'],"Собираем проект на python3&PyQT5 под Windows, используя PyInstaller","23,3k"
542,SanDark7,15,5.0,6.0,"['Машинное обучение', 'Scala', 'Python', 'Big Data', 'Блог компании Rambler Group']",Митап по Apache Spark,"3,5k"
543,RediHi,32,3.0,15.0,"['Информационная безопасность', 'Python', 'CTF']",UFOCTF 2017: декомпилируем Python в задании King Arthur (PPC600),"4,9k"
544,Arseny_Info,242,28.0,52.0,"['Машинное обучение', 'Алгоритмы', 'Python', 'Data Mining', 'Блог компании Open Data Science']",Открытый курс машинного обучения. Тема 6. Построение и отбор признаков,51k
545,Scorobey,58,1.0,16.0,['Python'],Спектральный анализ сигналов нелинейных звеньев АСУ на Python,"6,4k"
546,petropavel,48,,19.0,"['Отладка', 'Python', 'C++', 'C']",Украшаем жизнь с помощью gdb PrettyPrinting API,4k
547,Crait,148,10.0,9.0,"['Программирование', 'Python', 'API']","Создаем бота для Skype. Шаг за шагом, через REST API и на Python","16,2k"
548,SanDark7,4,1.0,,"['Python', 'Блог компании Rambler Group']",Moscow Python Meetup №44,"1,5k"
549,SanDark7,12,,3.0,"['Python', 'Блог компании Rambler Group']",Python Junior Meetup #2,"2,6k"
550,Delael,266,29.0,29.0,"['Python', 'API']",Скачиваем историю переписки со всеми пользователями ВКонтакте с помощью Python,"54,8k"
551,alexhouse,74,10.0,7.0,"['Разработка под e-commerce', 'Разработка веб-сайтов', 'Python', 'Django', 'CMS']","Запускаем простой блог на Wagtail CMS (Django) — часть 3, заключительная","8,2k"
552,olemskoi,168,30.0,64.0,"['Программирование', 'Высокая производительность', 'Python', 'Open source', 'Блог компании Southbridge']",Сможет ли Питон прожевать миллион запросов в секунду?,27k
553,vradchenko,262,25.0,54.0,"['Машинное обучение', 'Математика', 'Алгоритмы', 'Python', 'Блог компании Open Data Science']","Открытый курс машинного обучения. Тема 5. Композиции: бэггинг, случайный лес","61,9k"
554,m0rtido,43,4.0,25.0,"['Спортивное программирование', 'Машинное обучение', 'Python']",Варим ML Boot Camp III: Starter Kit,"8,9k"
555,andrewnester,63,,14.0,"['Программирование', 'Python']","Pygest #6. Релизы, статьи, интересные проекты из мира Python [14 марта 2017 — 27 марта 2017]","9,3k"
556,litvinenko1706,84,22.0,33.0,"['Разработка веб-сайтов', 'Python', 'Open source']",Как я SQLAlchemy удобной сделал,"16,8k"
557,Eugene713,60,10.0,35.0,"['Машинное обучение', 'Python']",Соревнование mlbootcamp от mail.ru. Кратко о рецепте второго места,"9,3k"
558,miptgirl,183,14.0,56.0,"['Машинное обучение', 'Математика', 'Python', 'Data Mining', 'Блог компании Open Data Science']",Предсказываем будущее с помощью библиотеки Facebook Prophet,"25,4k"
559,andd3dfx,81,16.0,6.0,"['Машинное обучение', 'Python']",Решение задачи кредитного скоринга методом логистической регрессии,"9,4k"
560,fall_out_bug,80,7.0,23.0,"['Геоинформационные сервисы', 'Визуализация данных', 'Python', 'Big Data', 'Блог компании Техносерв']",Использование ArcGIS API for Python в Jupyter Notebook,"8,7k"
561,AloneCoder,139,23.0,53.0,"['Python', 'Go', 'C', 'API', 'Блог компании Mail.Ru Group']",Вызов функций Go из других языков,"11,2k"
562,PavelVainerman,15,,8.0,"['Промышленное программирование', 'Отладка', 'Python']",Обзор uniset2-testsuite — небольшого велосипеда для функционального тестирования. Часть 2,"2,3k"
563,yorko,301,39.0,50.0,"['Машинное обучение', 'Математика', 'Алгоритмы', 'Python', 'Блог компании Open Data Science']",Открытый курс машинного обучения. Тема 4. Линейные модели классификации и регрессии,"95,1k"
564,alexhouse,152,17.0,17.0,"['Проектирование и рефакторинг', 'Python']",Yapf — причесываем код Python автокорректором,"14,3k"
565,PavelVainerman,23,4.0,10.0,"['Промышленное программирование', 'Отладка', 'Python']",Обзор uniset2-testsuite — небольшого велосипеда для функционального тестирования,"2,6k"
566,AntonioGrande,246,44.0,24.0,"['Программирование', 'Машинное обучение', 'Python', 'PostgreSQL', 'API']",Как искать паттерны в биржевых данных и использовать их в торговле?,"25,6k"
567,PatientZero,134,3.0,21.0,"['Разработка игр', 'Алгоритмы', 'Python']",Поиск пути в играх Tower Defense,"11,9k"
568,astrikovd,91,11.0,12.0,"['Разработка веб-сайтов', 'Программирование', 'Анализ и проектирование систем', 'Python', 'Django']","Что нам стоит сервис email-маркетинга построить? Взгляд изнутри, часть вторая","9,1k"
569,Scorobey,34,2.0,3.0,['Python'],Метод гармонической линеаризации средствами Python,"3,6k"
570,sovcharenko,215,11.0,53.0,"['Машинное обучение', 'Математика', 'Алгоритмы', 'Python', 'Блог компании Open Data Science']",Библиотеки для глубокого обучения Theano/Lasagne,"27,4k"
571,aborche,74,2.0,12.0,"['Системное программирование', 'Визуализация данных', 'Python', 'Asterisk']",Asterisk и не только. Виртуальные файловые системы. Шаг назад или два вперед?,"7,3k"
572,MonsterAndrew,92,15.0,21.0,['Python'],"История о том, как я парсер для дневника мастерил","10,7k"
573,yorko,427,46.0,61.0,"['Машинное обучение', 'Алгоритмы', 'Python', 'Data Mining', 'Блог компании Open Data Science']","Открытый курс машинного обучения. Тема 3. Классификация, деревья решений и метод ближайших соседей",110k
574,andrewnester,89,2.0,25.0,"['Программирование', 'Python']","Pygest #5. Релизы, статьи, интересные проекты из мира Python [28 февраля 2017 — 13 марта 2017]","9,6k"
575,gazpar,132,29.0,39.0,"['Программирование', 'Python']",Моделирование электрической цепи,"18,1k"
576,descine,189,11.0,19.0,"['Программирование', 'Машинное обучение', 'Python', 'Google API']",Speech AI с Python & Google API,"29,4k"
577,EverydayTools,95,6.0,20.0,"['Python', 'Блог компании Everyday Tools']",Анализ рекомендаций книг для разработчиков со Stack Overflow средствами Python,"12,8k"
578,Scorobey,43,2.0,1.0,['Python'],Полный латентно семантический анализ средствами Python,"4,8k"
579,miptgirl,412,45.0,52.0,"['Машинное обучение', 'Визуализация данных', 'Python', 'Data Mining', 'Блог компании Open Data Science']",Открытый курс машинного обучения. Тема 2: Визуализация данных c Python,108k
580,ptsecurity,80,39.0,28.0,"['Тестирование веб-сервисов', 'Тестирование IT-систем', 'Python', 'Блог компании Positive Technologies']",Проблемы тестирования: почему 100% покрытие кода это плохо,19k
581,SomeOneWhoCares,67,6.0,3.0,['Python'],Программа на Python для статистического анализа текста,"5,7k"
582,SomeOneWhoCares,122,16.0,3.0,['Python'],Реализация на Python многопоточной обработки данных для парсинга сайтов,"9,7k"
583,shutovds,203,274.0,94.0,"['Программирование', 'Python']",Почему в сорок лет я решил поменять профессию и стать программистом Python,"71,4k"
584,Scorobey,86,19.0,9.0,['Python'],Программа на PYTHON для определения авторства текста по частоте появления новых слов,"9,9k"
585,Olga_ol,69,,30.0,"['Разработка веб-сайтов', 'Python', 'Django', 'Блог компании Mail.Ru Group']",Новости наших онлайн-курсов: обновлен курс «Web-технологии» и добавлен «Постановка задачи на разработку ПО»,"7,9k"
586,Welltraum,87,27.0,31.0,"['Python', 'CAD/CAM', 'API']",Python на службе у конструктора. Укрощаем API Kompas 3D,13k
